name,author,link,rating,rating_count,review_count,pages_count,price,text_reviews,age,year
Fallout. Хроники создания легендарной саги,['Эрван Лафлериэль'],https://www.litres.ru/book/ervan-lafleriel/fallout-hroniki-sozdaniya-legendarnoy-sagi-69052543/,4.4,18,8,261.0,609.0,"['Отличная книга, для фанатов одноименной игры, лично я в детстве играл еще в первый две части и с радостью ознакомился с книгой. Рекомендую.', 'Я очень люблю серию игр Fallout. Впервые познакомился с ней, когда вышла третья часть и влюбился в этот антураж. Столичная Пустошь была исхожена мной вдоль и поперек. А за ней и Мохаве. А потом и Содружество.\nКнига же рассказывает о том, как игра создавалась. Какой путь серия проделала за почти 20 лет жизни и чего нам, игрокам, ждать в будущем.\nДетально разбираются все аспекты игр: сюжеты, диалоги, боёвка, ролевая система и т.д.\nИ каждый из элементов разбирается последовательно от Fallout: A Post Nuclear Role Playing Game до Fallout 4. Онлайновая Fallout 76 на момент написания книги еще не вышла. Не говоря уж о сериале от Amazon.\nВ целом, это интересная история, которую читает великолепный Александр Гаврилин. Любителям видеоигр и фанатам пост-ядерного американского мира читать обязательно. Остальным - на свой страх и риск.', 'Замечательное погружение в историю создания, в идеи, планы, процессы, механизмы, мнения и прочее любимой серии игр. Хорошо проделанная работа по сбору информации и перелопачиванию старых интервью. Спасибо автору за труд!', 'Недавно ознакомилась с данной книгой на волне просмотра одноименного сериала на Амазон. Начало довольно интересное. Как они собирались вместе. Как придумывали сеттинг, как сама судьба им помогала создать свой проект. А затем, как созданную серию мотало отстудии к студии, и как та изменялась с годами.', 'Прочитал примерно 70% книги, планирую как-нибудь осилить до конца, но уже понятна концепция:\n- Первая часть ошеломительна\n- Вторую слишком спешили сделать, поэтому вышло так себе, но тоже хорошо\n- Третьей части лучше бы не было, Бесезда всё испортила\n- Нью Вегас крутая, потому что её делали отчасти те, кто и должен был\n- Четвёртая часть такая себе, Бесезда что-то поняла и начала что-то делать, но всё равно не так.']",16+,2017.0
Усиленное обучение,['Джеймс Девис'],https://www.litres.ru/book/dzheyms-devis-33032713/usilennoe-obuchenie-70772995/,5.0,158,6,150.0,490.0,"['когда думаешь, что вроде разобрался с темой машинного обучения, а тут еще полно всего,,, просто бесконечность. Но книги определенно помогают хоть немного держаться в теме на плаву. показывают, применяемые сейчас алгоритмы', 'Из книги узнал много нового, ошибочно думал, что не должно сильно отличаться от других видов обучения, но на практике оказалось совсем иначе. Так что книга оказалась полезной и главное понятной!', 'Подробное описание, можно использовать. Во всяком случае мне было понятно, если что-то не знал то гуглил и читал. Главное знать что гуглить, а книга об этом говорит. Спасибо автору за труд!', 'Книга определенно полезная! Для тех кто работает в теме нейросетей очень пригодится. Показывает разные инструменты, как они работают, приводятся примеры с пояснениями. Советую.', 'По данной теме книг пока еще мало, искал и наткнулся на эту. В целом книга хороша, очень подробная. Выделил для себя основные инструменты, понял возможности и где именно это все применяется.']",12+,2024.0
PHP. Разработка модуля комментариев для сайта,['Дмитрий Приходько'],https://www.litres.ru/book/dmitriy-prihodko-31959965/php-razrabotka-modulya-kommentariev-dlya-sayta-67276092/,5.0,3,2,129.0,,"['Книга предназначена для читателей, знакомых с общим синтаксисом PHP и имеющих опыт его использования. Она может быть полезна как для активных новичков, которые хотят проверить свои навыки и узнать больше о возможностях PHP, так и для опытных разработчиков, которые ищут конкретное решение для создания модуля комментариев на своем сайте', 'Книга – очень полезная благодаря коду, простой и доходчивой логике автора, изложившего свой путь создания модуля. Рекомендую всем начинающим и интересующимся программированием.']",6+,2021.0
Java для всех (pdf+epub),['Алексей Васильев'],https://www.litres.ru/book/aleksey-nikolaevich-vasilev/java-dlya-vseh-pdf-epub-48613341/,4.3,24,6,513.0,599.0,"['Мне понравился стиль изложения: последовательный, как будто книга рассчитана именно на человека, имеющего некоторое понимание, что такое программирование, но, в то же время, не являющегося профессионалом. Написано достаточно понятно. Благодаря книге решил не идти на курсы прямо сейчас, а только после прочтения, уже с пониманием, какие именно курсы нужны, на что обратить внимание.', 'Замечательный учебник, и действительно для всех! Изучал вместе с ребятами в онлайн на кружке – всем понравилось.Нашёл прежние свои ошибки. В общем, книга на все 100.', 'Хороший учебник для начинающих программистов, рекомендую для самостоятельного изучения, это дёшево чем платить за обучение в университете', 'Хорошая книга, особенно для начинающих программистов. Все понятно и интересно изложено. Хотелось бы побольше информации о библиотеках, которые есть в Java.', 'В книге хорошо рассматриваются основы Java. После каждой главы, как правило, практические упражнения на применение темы. Только смутило, что эти упражнения в основном с математическим уклоном. Не очень сходится с названием ""Книга для всех"". Однако, это хорошая практика для подготовки к предстоящим собеседованиям!']",16+,2019.0
Программирование на Python с нуля,['Максим Кононенко'],https://www.litres.ru/audiobook/maksim-kononenko-32575672/programmirovanie-na-python-s-nulya-69253624/,3.3,14,4,,89.0,"['Не стоит тратить время, книга ни о чем, такое ощущение что ее написал chat gpt, на вопрос что такое язык python? Не аудиокнига, а реферат', '1082942217, Есть немного chat gpt( (В след. раз постараюсь написать сам и подробнее)', 'помогает определиться что делать дальше и как действовать, для начало пути новичок, в сфере программировании на python…', 'ни о чем, введение и все. Пайтон это язык, который используется там то и вам то, может то и то))) если заменить слово Пайтон на джава будет бесплатная книга для другого языка', 'Для начинающего программиста – это очень хорошая книга нужно просто сидеть записать что говорит автор какие программы и что нужно вместе с ним выучить.']",0+,2023.0
"Как создать мобильное приложение и зарабатывать от 10000$ в месяц, если вы начинающий разработчик или вообще ничего в этом не понимаете",['Александр Евгеньевич Попов'],https://www.litres.ru/book/aleksandr-evgenevich/kak-sozdat-mobilnoe-prilozhenie-i-zarabatyvat-ot-69529729/,4.4,8,1,81.0,690.0,['Классная книга мне понравилось рекомендую другим тоже читателей. Я долга искал такую книгу заработок интернете ещё профессия +'],12+,2023.0
JavaScript для начинающих,['Майк МакГрат'],https://www.litres.ru/book/mayk-makgrat/javascript-dlya-nachinauschih-17254044/,4.0,139,8,232.0,569.0,"['Эта книга – неплохое введение в программирование на Java. В отличие от многих других книг по Java, она предлагает начать изучение с азов – чистого JDK, а не проектов в средах разработки NetBeans или Eclipse. Оказывается, для создания приложений с графическим интерфейсом пользователя достаточно простого текстового редактора.', 'Отличная книга! Благодаря этой книге я узнал много нового о Java и о программировании в целом. Рекомендую к прочтению всем программистам-новичкам.', 'Примеры кода хорошие, простые и иллюстративные, но текст безобразный,\xa0– перевод точно такой, но думаю, что и оригинал не лучше. Пример:""В JavaScript объект promise представляет окончательное завершение или сбой асинхронной операции и ее результирующее значение"". Хочется спросить – «что я только что прочитал?». В общем и целом не рекомендовал бы.', 'Я программист 1С 11 лет, немного работал с VB6 и VBA, немного кодировал на Arduino (похоже по синтаксису на C). Решил изучить JavaScript, чтобы понять синтаксис языков основанных на С. Меня привлекло оформление, охват содержания.  В итоге, был разочарован, т.к. подача материала не для начинающих. Для понимания материала необходим опыт в каком-нибудь другом языке программирования. Кроме того, судя по выкручивающим мозг фразам, перевод сделан не профессионалом по программированию, а ""дядей Васей"", который как смог, так и перевёл. Перевод ужасный. Я сам пишу инструкции, по этому знаю, насколько важно точно и выверенно написать каждое предложение. Перевод - выносит мозг. Новичкам, однозначно, не рекомендую.', 'Очень не подходит для начинающих осваивать с азов , слишком  большой поток мыслей , а ведь надо вести за руку , а не талдычить, как на школьном уроке!']",12+,2020.0
Справочник по нейронным сетям: от теории к практике,['Виталий Александрович Гульчеев'],https://www.litres.ru/book/vitaliy-aleksandrovic/spravochnik-po-neyronnym-setyam-ot-teorii-k-praktike-68908563/,4.0,4,0,27.0,99.9,[],12+,2023.0
А ты готов опознавать котов? Нейросети и котики – детям,"['Максим Попов', 'Алиса Попова']",https://www.litres.ru/book/alisa-popova/a-ty-gotov-opoznavat-kotov-neyroseti-i-kotiki-detyam-65803178/,3.9,9,1,41.0,99.9,"['Фактически, это тянет максимум на пост где-нибудь на пикабу, не больше: минимум объяснений, один кусочек кода и… все. Ребёнка таким не заинтересовать. Тройка только за интригующее название', 'Добрый день, Markv5!']",6+,2021.0
Задачник по PHP (с решениями),['Роман Игоревич Григорьев'],https://www.litres.ru/book/roman-igorevich-grigorev/zadachnik-po-php-s-resheniyami-30482497/,3.9,21,5,39.0,119.0,"['Сырой, недоработанный сборник задач с сайтов по помощи php ( задачи один в один), с кучей ошибок, как в дано, так и в решениях', 'Много ошибок! плохо читаемый код в условиях и решениях. Видимо герой данной книги копипаст-@утист!', 'Всем привет эту книгу я наткнулся нечаянно начал читать первую страницу и вижу всё там объясняется всё рассказывается и есть задачи. Как нужно решать !)', 'Arthur Mironovsky я обрадовался но потом ребята пишут что это нерабочая книга', 'Жаль потраченых денег. Книга содержит очень много ошибок и опечаток. Код, представленный в решениях зачастую нерабочий или реализация решения приводится через ж..пу, что ставит начинающих программистов на неправильный путь.', 'Хороший сборник задач, есть большое количество тематических задач, вариантов задач много, можно найти нужную задачу, всё по делу, ничего лишнего!']",12+,2018.0
Занимательное программирование – игры с текстом,['Дмитрий Юрьевич Усенков'],https://www.litres.ru/book/dmitriy-urevich-usenkov/zanimatelnoe-programmirovanie-igry-s-tekstom-63099338/,5.0,1,0,65.0,99.9,[],12+,2020.0
Грокаем машинное обучение (pdf + epub),['Луис Серрано'],https://www.litres.ru/book/luis-serrano-32912851/grokaem-mashinnoe-obuchenie-pdf-epub-70290604/,4.4,3,3,512.0,699.0,"['Есть полезная информация, но многовато воды, часто излишне одно по одному. Я считаю количество страниц можно было вдвое сократить.', 'Книга охватывает довольно много алгоритмов машинного обучения, изложение очень доступное, какие-то вещи автор подаёт действительно очень просто и понятно. В целом, не пожалел что прочёл', 'Полезное издание, понятные термины и объяснения. Конечно цена высокая, но для деловой литературы это нормально. Советую к приобретению если тема машинного обучения актуальна для изучения']",16+,2021.0
Этой кнопке нужен текст. O UX-писательстве коротко и понятно,['Кирилл Егерев'],https://www.litres.ru/book/kirill-egerev/etoy-knopke-nuzhen-tekst-o-ux-pisatelstve-korotko-i-ponyatno-63613191/,4.1,89,18,168.0,599.0,"['Плюсы:', 'Ну что..Зашла на hh и обнаружила, что вакансий UX писателя почти нет! К профессии у нас пока что явно относятся с недоверием, но хочется верить, что после выхода этой книги всё изменится. Жаль, никакой литературы про UX не было год назад, когда мы переделывали наше мобильное приложение и сайт. Будет полезно прочитать не только копирайтерам, но и всем, кто работает над продуктом. Егерев очень наглядно показывает, как устроен мозг пользователя, вплоть до функций его моторики. Книгой довольна)', 'Мягко говоря книга не оправдала ожиданий. Все исправления, как примеры профессиональной работы – нечто несуразное. Не рекомендую даже новичкам.', 'Да уж, конечно ощутимая разница когда вы всем офисом переводите англоязычные статьи по UX, и потом выходит целая книга. Есть конечно спорные моменты, например кейсы про сообщения об ошибке. Но тем не менее это супер важная книжка. Мастрид всем копирайтерам, которые хотят обучиться UX и понимать интерфейс.', 'Достойная книга для еще не очень понятного для России направления. Все что находила, только из американских источников. Автор понятно рассказывает, что же такое ux вообще и как с этим работать. Очень жду печатную версию.']",0+,2021.0
Мир ChatGPT: Понимание и Применение Искусственного Интеллекта,"['Виталий Александрович Гульчеев', 'Искусственный Интеллект']",https://www.litres.ru/book/vitaliy-aleksandrovi/mir-chatgpt-ponimanie-i-primenenie-iskusstvennogo-int-69088657/,4.1,14,2,36.0,99.9,"['Написана легко, доступным языком. Толковой информации к сожалению мало. Но для начала самое то. Рекомендую тем, кто только начинает изучение в данной сфере.', 'Это конечно невероятная технология, какой невероятный потенциал! Тут можно только сказать спасибо ИИ, что сам о себе рассказал.']",12+,2023.0
"Карьера в IT. Как найти работу, прокачать навыки и стать крутым разработчиком",['Джон Сонмез'],https://www.litres.ru/book/dzhon-sonmez/karera-v-it-kak-nayti-rabotu-prokachat-navyki-i-stat-krutym-r-69394321/,4.7,11,3,791.0,699.0,"['Как и первая книга автора (""Путь программиста. Человек эпохи IT"", 2016) это объемное (790 страниц) издание однозначно бестселлер, настольная книга будущих и действующих программистов-разработчиков и IT-специалистов, желающих стать востребованными и высокооплачиваемыми специалистами.', 'Вода, одна вода. Все советы из разряда делайте хорошо, не делайте плохо. Общие поверхностные рассуждения. Жалко потраченных денег. Хотя, я могу ошибаться, составляйте своё мнение.', 'Отличная книга для ознаклмления с профессией! Понравился системный и структурированный подход. Если вы только начинаете свой путь в программировании, особенно, если вы начали изучение самостоятельно, то эта книга поможет понять, с чего начать и какую область программирования выбрать. Спасибо автору.']",12+,2017.0
