name,author,link,rating,rating_count,review_count,pages_count,price,text_reviews,age,year
#Сам себе программист. Как научиться программировать и устроиться в Ebay,['Кори Альтхофф'],https://www.litres.ru/book/kori-althoff/sam-sebe-programmist-kak-nauchitsya-programmirovat-i-ustroits-33397888/,4.2,128,25,210.0,299.0,"['Отличная книга чтобы начать программировать, для начинающих, которые обучаются самостоятельно с помощью книг и интернета. В этой книге вы узнаете об основах программирования на python, а затем углубитесь в более продвинутые темы. Думаю, вы не пожалеете о покупке этой книги.', 'Местами корявый перевод. Отступы в коде не везде соблюдены.', 'Прочёл замечательную книгу Кори Альтхоффа о том, как стать программистом. Помимо элементарного введения в язык Python это издание очень выгодно отличает почти пошаговый план обучения и освоения навыкам программирования из реальной жизни. Автор не только называет ключевые действия для освоения этой нужной и интересной профессии, но даёт конкретные советы и рекомендации, как это лучше сделать. Любопытно, что книга основана на реальном опыте, позволившем автору получить настоящую работу по IT-специальности. При этом книга написана очень легко и живо.', 'Читал эту книгу на английском, а в русский перевод лазил если было совсем не понятно.', 'Читаю восторженные отзывы о книге и удивляюсь. На каких новичков она рассчитана? Написано настолько сложно, что мозг просто закипает. Будучи нулем в программировании я итак непросто усваиваю массу терминов, синтаксис, функции и так далее, так еще и предложения построены невыносимо для чтения. Может мой мозг абсолютно не заточен под программирование, но… Просто зацените эту цитату: «Левая часть инструкции сверху определяет функцию, f, принимающую один параметр, x. Правая часть – определение функции, которое использует переданный параметр (x), чтобы произвести вычисление и вернуть результат (вывод).» Прямо академическое чтиво, но уж точно не для профанов в программировании((((']",12+,2017.0
"Сборник лабораторных работ для студентов учебных заведений, изучающих программирование в системе 1С:Предприятие 8 (1С:Enterprise 8) (+ epub)","['Павел Чистов', 'Алина Мальгинова']",https://www.litres.ru/book/alina-malginova/sbornik-laboratornyh-rabot-dlya-studentov-uchebnyh-zaveden-63799417/,5.0,11,4,491.0,250.0,"['Замечательная книга для начинающих. Очень радует использование последних версий программы 1С в качестве примеров. Не первую публикацию авторов читаю и все заслуживают большого уважения.', 'Очень хорошая книга для практики программирование в 1С, особенно для начинающих. Рекомендую всем начинающим программистам.', 'Очень хороший сборник лабораторных работ для студентов и начинающих разработчиков 1С. Огромная благодарность авторам за проделанный труд', 'Отличное наглядное и последовательное пособие для начинающего разработчика 1С!!!']",0+,2021.0
Расширения ядра Linux: драйверы и модули,['Олег Цилюрик'],https://www.litres.ru/book/oleg-cilurik/rasshireniya-yadra-linux-drayvery-i-moduli-70297339/,0.0,0,0,685.0,549.0,[],0+,2023.0
Unity в действии. Мультиплатформенная разработка на C# (pdf + epub),['Джозеф Хокинг'],https://www.litres.ru/book/dzhozef-hoking/unity-v-deystvii-multiplatformennaya-razrabotka-na-c-42225637/,3.9,16,4,448.0,799.0,"['Книга для начинающих программистов на Unity, книга неплохая. Недостатки есть, опечатки не всегда корректный перевод не всегда очевидные вещи, в общем все как обычно для переводной книги. Знание С# необходимо еще более необходимо знание построения алгоритмов.', 'Если опыта 0, лучше присмотреть другую книгу. Толком никаких объяснений. Куски кода приведенные в книге непонятно куда «пихать». Уже на стадии кода генерирующего врагов, стала вылетать ошибка в игре, а о ней в книге ничего не написано. Скрипт генерации огнешаров – непонятно куда дописывать и при переносе в функцию Update() выдает вагон ошибок компиляции', 'Книга для начинающих разработчиков Unity – хорошая, почти отличная! В ней есть опечатки и немного неверный перевод. В принципе для меня это единственные минусы. Книга объясняет базовую работу с движком, в 3D и 2D. Для старта очень даже ничего, но советую читать в оригинале.', 'Купил книгу в печатном виде. Я только нервы сорвал( ничего не получилось, много воды, а где то наоборот не достаточно объяснений. Не советую покупать эту книгу.']",16+,2022.0
Введение в рекурсивное программирование,['Мануэль Рубио-Санчес'],https://www.litres.ru/book/manuel-rubio-sanches/vvedenie-v-rekursivnoe-programmirovanie-43643419/,5.0,2,0,438.0,990.0,[],0+,2018.0
Akka в действии,"['Раймонд Рёстенбург', 'Робб Баккер']",https://www.litres.ru/book/raymond-restenburg-21050895/akka-v-deystvii-48411239/,4.4,3,1,524.0,790.0,"['Отличная книга! Полностью раскрываются основы акторной системы. Единственный минус, что версия классическая, в отличие от новой – типизированной']",0+,2017.0
Нейросети начало,['Джейд Картер'],https://www.litres.ru/audiobook/dzheyd-karter/neyroseti-nachalo-69246082/,4.7,29,1,,174.5,"['Книга полезна, хоть и много кода для аудио версии. Всегда можно вернуться к электронной версии и взять код. Для начала понимания нейронных сетей самое то.']",12+,2023.0
Автоматизация рутины в Excel VBA. Лайфхаки для облегчения скучных рабочих задач,['Виктор Николаевич Шитов'],https://www.litres.ru/book/viktor-shitov/avtomatizaciya-rutiny-v-excel-vba-layfhaki-dlya-oblegcheniya-69230242/,4.4,5,0,450.0,239.0,[],12+,2023.0
JavaScript. 20 уроков для начинающих,['Владимир Дронов'],https://www.litres.ru/book/vladimir-dronov/javascript-20-urokov-dlya-nachinauschih-66338206/,4.4,10,5,347.0,520.0,"['Недавно закончил изучать эту книгу. Могу сказать что она неплоха . В ней дается много практических заданий - практически после каждого параграфа идет упражнение.  В конце каждой главы идут самостоятельные задания , которые позволяют проверить полученные знания.  Мне удалось изучить эту книгу менее или около полугода , но уже на середине книги я создал свое первое веб приложение.', 'Владимир Дронов – автор такой «мини библиотеки» для начинающего программиста, которым я и являюсь. Я купил уже одну его книгу «HTML и CSS. 25 уроков для начинающих» и остался очень доволен. Наверное, это лучшее вложение в моей жизни. :) Как всегда, ежемесячно покупаю по 4 книги по абонементу (4-я – бесплатно!). Теперь о книге. Автор с первых строк берет быка за рога. Ни воды, ни лирики, в общем – ни одного лишнего слова. А лишние, не информационные слова – это наше время. Из множества книг выбрал эту для себя и нисколько не жалею. Рекомендую.', 'Для изучения JavaScript по данной книге нужно знать только HTML и CSS. Даны упражнения с подробным разбором, в результате выполнения которых всё отлично запоминается.', 'Понравилась книга автора про html, думал, что и в этой книге автор применит аналогичный подход. Но этого не произошло почему-то. Изложение краткое, сумбурное, теории много, закрепления непропорционально мало, самостоятельные упражнения новичку со средними способностями выполнить порой нереально.', 'Весьма хорошая и толковая книга от известно автора и программиста с многолетним стажем. Отличная книга от известного автора. В настоящее время веб-приложения очень актуальны. Все по полочкам разложено, как надо. Для новичка самое то. Автор молодец!']",0+,2020.0
Основы Java,['Николай Прохоренок'],https://www.litres.ru/book/n-prohorenok/osnovy-java-39288481/,3.9,18,4,765.0,449.0,"['Материал очень хорошо изложен. Весьма достойная книга по Java. Местами встречается излишнее описание методов и пр., что можно посмотреть и в java doc и отсутсвует вывод работы классов(он присутствует в комментариях, но не всегда). Книга позволяет запоминать и делать выводы, что хорошо сказывается на усвоении материала. Отлично подойдёт для новичков(джуниуров) и тех «кто знал, но забыл».', 'mikluchomaklay3, ахахаххаах лол я скачал эту книгу бесплатно и экономил 400рубл', 'Всем привет! Как по мне эта книга просто отличная находка для новичков которые хотят изучить основы Java, в ней очень понятно расписано абсолютно ВСЁ что нужно знать новичку. При необходимости её можно использовать как справочник) Всем кто хочет начать изучать Java советую начать именно с этой книги!', 'я его купил в этой программе чтобы читать было удобно , но pdf формат здесь не настроен это дико напрягает неудобно читать , читаешь все летает листнул или задел экран теряется страница уходит на середину это вообще бесить как так можно , за такие купил чтобы разочароваться.', 'Shumkarbek Rahmanov, чел я скачал это бесплатно', 'Изучил достаточное количество книг по Джаве для начинающих (Head First, Полное руководство Шилтда, Эффективное программирование Блоха) и с уверенностью могу сказать, что именно эта книга по-настоящему может открыть глаза на мир программирования для новичка. Однозначно рекомендую к прочтению, если вы новичок или пришли с другого языка']",0+,2019.0
Программирование на C++ в примерах и задачах,['Алексей Васильев'],https://www.litres.ru/book/aleksey-nikolaevich-vasilev/programmirovanie-na-c-v-primerah-i-zadachah-22054458/,4.0,78,16,369.0,419.0,"['Я купил эту книгу в бумажном виде, прочитав страниц 100 в моей голове ровно ничего не произошло (это не значит что у меня там пусто). В книге объясняется все плохо!!! Никаких внятных объяснений, в названии говорится что там есть примеры там их нет. В книге все написано в сложных формулировках и туманно то есть не понятно. Такая книга кроме головной боли ничего не принесёт. Худшее для начинающих. И задания которые даются в конце параграфа, давать новичку задания когда он еще даже основ не знает, боже как тупо.', 'MYKYTA SLIUSAREV, Ваше негодования ни к чему! Скорее всего у вас нету мозгов, чтобы понимать материал. Книга прекрасная и в ней ""Примеры"" - это листинги и шаблоны. А слова ""Худшее для новичков"" в полной мере не походит. Здесь нужно вникать в текст, там всё расписано. В том числе, как и какая команда работает.', 'Отличная книга для тех, кто реально хочет научиться. И я не согласен с нытьем других комментаторов. Все хорошо объясняется, но не стоит думать, что на одной книге вы превратитесь в в гения программиста.', 'К сожалению данного автора советовать не могу. Всё дано одной кучей, чувство такое что тебя за час хотят научить программировать на с++ и дают за этот час все от базы до ООП. Написано легко, объясняется все понятным языком но информация подаётся вся и сразу что наврятли уложиться в голове новичка не знакомого с программированием.', 'Кратко: книга не про программирование на C++, а про решение математических задач.', 'Советую книгу Васильев А Н самоучитель С++ с задачами и примерами издательства НиТ. Иногда я её до сих пор открываю, чтобы потренировать мозги.']",12+,2017.0
Основы Python для Data Science (pdf + epub),['Кеннеди Берман'],https://www.litres.ru/book/kennedi-berman/osnovy-python-dlya-data-science-pdf-epub-69154048/,5.0,1,1,272.0,499.0,"['Книга подойдет тем, кто уже имеет опыт в программировании (на любом языке). Примеры хорошо разжеваны и прокомментированы. Большой плюс - книга написана инженером-пограммистом, так что вы не увидите тут ошибок, типичных для ситуации когда концепции из области программирования пытается объяснить аналитик-прикладник.']",16+,2022.0
Пользовательские истории. Искусство гибкой разработки ПО,['Джефф Паттон'],https://www.litres.ru/book/dzheff-patton/polzovatelskie-istorii-iskusstvo-gibkoy-razrabotki-po-24396028/,4.5,31,8,393.0,755.0,"['За книгу 5 баллов, за перевод 1 балл. Некоторые обороты просто ужасны и не адаптированы на русский язык. Переведено как будто дословно в том порядке в каком написаны английские слова. Разве так можно???', 'Дмитрий Куликов, раз вы так экспертно об этот заявляете – читайте в оригинале, какие проблемы?', 'Занимаюсь проектирование программного обеспечения и информационных систем более 10 лет. Могу с уверенностью сказать, что книга очень хорошая. В книге хорошо описана концепция пользовательских историй в контексте разработки ПО (зачем они нужно и что дают?). При этом в книге множество конкретных примеров и практических рекомендаций для применения. Книга будет очень полезна для начинающих аналитиков, менеджеров продукта и в целом всем участникам проектов по разработке ПО. Пользовательские истории это общий знаменатель для всех участников проектных команд.', 'отличная книга с детальным пояснением того, что дают карты историй, как их применять на практике. приведены живые примеры коллег автора. очень легко читается, как диалог с автором', 'Много примеров в каждой главе – это здорово. Но книге не хватает одного сквозного примера, который бы прорабатывался с каждой главой.', 'Книга полезная, есть продвинутые идеи относительно основателей. Есть смысл почитать и начинающим и опытным, не только разработчикам ПО, но и всем, кто проявляет интерес к новим методам работы над интеллектуально-емкими продуктами.']",12+,2014.0
"Технология. 3D-моделирование, прототипирование и макетирование. 9 класс","['А. В. Гриншкун', 'В. Б. Лабутин']",https://www.litres.ru/book/a-v-grinshkun/tehnologiya-3d-modelirovanie-prototipirovanie-i-maketirovani-68297144/,5.0,1,0,65.0,500.0,[],0+,2022.0
Объектно-ориентированное программирование с помощью Python,['Ирв Кальб'],https://www.litres.ru/book/irv-kalb/obektno-orientirovannoe-programmirovanie-s-pomoschu-python-70281793/,4.4,3,3,515.0,749.0,"['Книга однозначно полезная, читать интересно, добавляет знаний по ООП, только работать с ней неудобно, нет оглавления. Добавьте оглавление поставлю 5 звезд.', 'Отличная книга для всех желающих освоить объектно-ориентированное программирование в современном и востребованном языке высокого уровня Python.', 'Отличная книга про реализацию различных аспектов обьектно-ориентированного программирования на Python с отпажением различных интересных примеров']",12+,2022.0
Как быть успешным в Data Science. Эффективное управление проектами и развитие профессиональной команды,"['Цзикэ Чонг', 'Юэ Кэти Чанг']",https://www.litres.ru/book/czike-chong/kak-byt-uspeshnym-v-data-science-effektivnoe-upravlenie-proekt-70499026/,5.0,1,0,642.0,749.0,[],12+,2021.0
