name,author,link,rating,rating_count,review_count,pages_count,price,text_reviews,age,year
Информатика. 6 класс,"['Л. Л. Босова', 'А. Ю. Босова']",https://www.litres.ru/book/anna-bosova/informatika-6-klass-68294021/,4.0,2,2,226.0,500.0,"['мне нравится. это очень хорошая книга. очень вам благодарна за то, что вы выпускаете ещё больше книг с таким названием.! я очень этому рада.', 'Пользуюсь в электронном виде. Спасибо за книгу.']",0+,2022.0
Веб-дизайн для недизайнеров (pdf + epub),['Трэйси Осборн'],https://www.litres.ru/book/treysi-osborn/veb-dizayn-dlya-nedizaynerov-pdf-epub-67891388/,4.8,5,1,176.0,499.0,"['Мне понравилась книга, написана без воды. Понятным языком. Поможет наверное каждому начинающему  веб-дизайну. Советую людям не разбирающимся в теме!']",16+,2021.0
Программирование для дополнительной и виртуальной реальности,['Джеймс Девис'],https://www.litres.ru/book/dzheyms-denis/programmirovanie-dlya-dopolnitelnoy-i-virtualnoy-realnosti-70641874/,5.0,310,5,541.0,690.0,"['Книга конечно не развлекательного характера, но весьма занимательная. Чтобы был процесс продуктивнее нужно пробовать примеры. ТОгда становится понятнее как что работает.  Иначе как и всегда в программировании можно уснуть. Есть много полезных моментов, главное их увидеть и сложить общую картину в голове.', 'Полистал и понял, что в данной теме стоит немного разобраться. Появляется много нового каждый день и просто иногда не успеваешь. Книга показывает разные направления и возможности в этой области программирования. Можно выделить несколько инструментов рабочих. В скором будущем будет очень актуально.', 'По теме виртуального программирования книг не много, но тема актуальная. Конечно не стоит надеяться, что одна книга сделает из вас профи. Поэтому я этого не ждал. Но после прочтения мне стали понятные некоторые направления, в которых можно развиваться дальше. Хороший обзор возможностей показан на легких примерах.  В таких книгах мне всегда чего-то не достает, и со временем я понял, что это нормально. Всегда ищу инфу дополняющую.', 'Не могу сказать что книга легкая, но и тема не простая. Однозначно много полезного разъяснительного материала и примеры.', 'очень крутая книга, наглядно показывает как устроена и работает основа создания VR и AR. какие используются инструменты и возможности. на мой взгляд, информация очень нужная тем, кто хочет начать или уже работает с этой темой.']",12+,2024.0
Объектно-ориентированное программирование: с нуля к SOLID и MVC,['Григорий Макеев'],https://www.litres.ru/book/grigoriy-makeev/obektno-orientirovannoe-programmirovanie-s-nulya-k-solid-i-70980220/,0.0,0,0,269.0,349.0,[],0+,2024.0
"PHP, MySQL, HTML5 и CSS 3. Разработка современных динамических Web-сайтов (pdf+epub)",['Владимир Дронов'],https://www.litres.ru/book/vladimir-dronov/php-mysql-html5-i-css-3-razrabotka-sovremennyh-dinamichesk-19213333/,3.9,65,2,677.0,448.0,"['Книга достойна для потребителя!', 'Отличная книга от известного автора. В настоящее время технологии PHP, MySQL, HTML5 и CSS 3 очень популярны при создании приложений. Все по полочкам разложено, как надо. Для новичка самое то. Автор молодец!', 'vvvital, Баллы отзывами непрочитанных книг зарабатываете?']",0+,2016.0
Создай свой VPN. Безопасное использование интернета,['Джейд Картер'],https://www.litres.ru/audiobook/dzheyd-karter/sozday-svoy-vpn-bezopasnoe-ispolzovanie-interneta-70425325/,5.0,1,0,,490.0,[],12+,2024.0
IT Компас: как правильно программировать IT-карьеру,['Илья Кырчумару'],https://www.litres.ru/audiobook/ilya-kyrchumaru/it-kompas-kak-pravilno-programmirovat-it-kareru-70953118/,0.0,0,0,,490.0,[],0+,2024.0
Laravel – гайд по выживанию,['Nulls'],https://www.litres.ru/book/nulls/laravel-gayd-po-vyzhivaniu-69850618/,4.4,14,6,80.0,89.9,"['Книга  представляет собой ценный ресурс для разработчиков, которые хотят узнать больше о фреймворке Laravel. Она предназначена не только для начинающих разработчиков, но и для тех, кто уже имеет некоторый опыт работы с Laravel. Она может быть полезна для любого, кто хочет углубить свои знания и навыки в этой области. В целом - это полезный и информативный ресурс для любого, кто интересуется разработкой на Laravel. Она поможет вам улучшить свои навыки и знания в этой области, а также сделает процесс обучения более интересным и приятным', 'Шикарная книга. Спасибо автору! Нашел ее через youtube канал Web Junior. Всем кто интересуется фреймворком Laravel - советую!', 'Смешные отзывы. Из книги ничего нового и интересного не нашел для себя. Подойдет для тех кто толлько начал, есть книги и материалы куда лучше и бесплатно', 'На самом деле, отличный краткий справочник по созданию каркаса приложения на Laravel. Тот самый вариант, когда все разложено по полочкам и дальше сам уже ковыряйся в глубине сколько хочешь. Книга однозначно для новичков, но уже знающих PHP (с окружением) на базовом уровне.', 'Краткое введение во фреймворк ларавел.']",12+,2023.0
"Волшебный Python. Сказка для детей и новичков, с наглядным и ясным кодом",['Артем Демиденко'],https://www.litres.ru/book/artem-demidenko/volshebnyy-python-skazka-dlya-detey-i-novichkov-s-naglyadn-71013385/,5.0,1,0,70.0,199.0,[],0+,2024.0
Программируемые контроллеры. Стандартные языки и приемы прикладного проектирования,['И. В. Петров'],https://www.litres.ru/book/igor-petrov-2/programmiruemye-kontrollery-standartnye-yazyki-i-priemy-prik-8336941/,3.9,14,2,255.0,400.0,"['книжка 2010 года, что о ней сказать в 2022-м?.. обо всем и ни о чем. не читайте это, читайте мануалы к оборудованию, желательно в оригинале.', 'Отличный материал, все понятно доступно.']",0+,2010.0
Основы программирования на языке Python,[],https://www.litres.ru/book/n-u-boklag/osnovy-programmirovaniya-na-yazyke-python-17004921/,3.8,8,0,92.0,400.0,[],0+,2014.0
Робототехника. Конструктор SPIKE. 5–8 классы. Учебное пособие,['Д. Г. Копосов'],https://www.litres.ru/book/d-g-koposov/robototehnika-konstruktor-spike-5-8-klassy-uchebnoe-posobie-66645350/,4.8,8,2,177.0,450.0,"['Очень удобная и интересная книжка для меня и моих кружковцев. Красочные иллюстрации, понятное, интересное и увлекательное описание делают эту книгу незаменимым помощником как для самостоятельных занятий, так и для кружковой работы по основам робототехники.Мои ребята были в восторге, когда увидели первые страницы на большом классном мониторе. В общем, очень полезное и нужное учебное пособие. Тем более, что это пока единственная работа отечественных авторов по Spike Prime.', 'Хорошее пособие. Красиво оформлено, много иллюстраций, информация по теме. Шрифт удобный для чтения, можно заниматься по нему и самостоятельно']",6+,2021.0
Mac OS X Snow Leopard. Основное руководство,['Дэвид Пог'],https://www.litres.ru/book/devid-pog/mac-os-x-snow-leopard-osnovnoe-rukovodstvo-24499630/,3.7,3,0,882.0,390.0,[],0+,
Impact mapping: Как повысить эффективность программных продуктов и проектов по их разработке,['Гойко Аджич'],https://www.litres.ru/audiobook/goyko-adzhich/impact-mapping-kak-povysit-effektivnost-programmnyh-produkto-51242157/,3.8,45,7,,499.0,"['Очередная книга в «американистикой» стиле, в которой многократно с кучей примеров описывается только одна мысль, в данном случае «правильно поставь цель/задачу»', 'Очень расплывчато. Глава «Итеративная разработка» очень характерна в этом плане. 1 абзац вроде бы о том что такое итеративная разработка, 3 о то что этого недостаточно и описание причины, 5 о том что данная методология позволяет эту проблему решить, только вот ни слова о том как нет.', 'Чёт такое себе :(', 'Impact Mapping является одной из активностей, которые сделают и заказчиков и разработчиков более счастливыми и эффективными. Книга для введения в эту технологию написана консультантом по стратегиям разработки ПО, и довольно легко читается. Рекомендую для тех кто только планирует изучать impact mapping и какую пользу он может принести вашему проекту. Для более опытных специалистов хотелось бы добавить еще достойных примеров применения этой методики, подробных кейсов с разбором разных ситуаций и т.д.', 'Может, я что-то не понимаю, но похоже на вебинар, целью которого является рекламирование какого-либо продукта. Озвучено качественно']",12+,2012.0
Программирование для Android,['Денис Колисниченко'],https://www.litres.ru/book/denis-kolisnichenko/programmirovanie-dlya-android-5582097/,3.9,16,5,285.0,384.0,"['вот уже полгода пытался найти что-нибудь подходящее для изучения основ программирования андроид. и всегда в пособиях чего-то не хватало, а именно как на практике решить проблемы с запуском и отладкой приложений, все статьи в нете как под копирку, и ни слова о решениях возникших проблем. но эта книга – настоящая находка для начинающих. все в ней четко и доступным языком описано с большим количеством практических примеров, которые не только работают, но и детально разобраны. так что всем начинающим андроид-программистам рекомендую.', 'Книга очень классная. Хотя некоторые вещи (в частности, использованные в книге средства разработки) на сегодняшний немного устарели (вышли свежие версии), сути это не меняет. Если хотите научиться программировать для Андроид, и не знаете, с чего начать, то начните с этой книги.', 'Книга очень полезна для программирования, написано доходчивым языком. Версии немного устаревшие, но разобраться можно.В общем книга мне очень понравилась. Советую всем кто желает начать программировать.', 'Это уже вторая книга автора, которую я здесь купил. Несомненные плюсы, по моему мнению, заключаются в плавном погружении в тему. Хотя, читателям без навыков программирования, будет сложно. Согласен, что на 2015 год материал устарел, сама установка среды программирования усложнилась. Однако, опираясь на базовые принципы, описанные в книге, можно все сделать. У меня возникли затруднения только при установке всех компонентов эмулятора на Windows. Тут отошел от книги, а само программирование для платформы Android изложено очень доступно.', 'Книга хорошая. Также присоединюсь к предыдущим отзывам: уже устаревшая, не все что описано будет работать. Автор описывает особенности новой (на год верстки) если не ошибаюсь версии android 9. Пишет толково, дает характеристику аппаратного обеспечения используемого в мобильных устройствах. Рекомендую для начинающих. Надеюсь автор внесет коррективы в новую редакцию.']",0+,2020.0
С нуля до Python-разработчика,['Фин Дерт'],https://www.litres.ru/book/fin-dert/s-nulya-do-pitonista-68753790/,3.5,15,5,24.0,299.0,"['Книга отличная!Для тех, кто хочет познакомиться с основами Python будет однозначно полезна. Не перегружена специальной терминологией, думаю даже ребёнок разберётся, благодарю автора!', 'Такое чувство, что написал шестиклассник, изучавший язык программирования пару дней. Ошибки грамматические, фактические. В общем, не стоит тратить деньги и время.', 'Отличная книга. Описывает основы максимально простыми словами и без сложных терминов. Смотрел уроки на ютубе, но ничего не понял. С книжкой смог понять некоторые азы. Теперь намного легче смотреть видосы на ютубе', 'самое то, для новичков в питоне. она рассказывает о базовых возможностях и заглядывает чуть глубже. однако может оказаться весьма короткой', 'Интересно, насколько хорошо автор книги знает Python?']",12+,2022.0
Самоучитель игры на Паскале. ABC и немного Турбо,['Н. Ю. Комлев'],https://www.litres.ru/book/n-komlev/samouchitel-igry-na-paskale-abc-i-nemnogo-turbo-8342572/,3.7,3,2,257.0,300.0,"['Классная книга! Хороший автор! Pascal очень популярен в школах как учебный язык. Материала для обучения языку очень много, но этот материал хорошо подобран, написан интересным, понятным языком! Рекомендую учителям, школьникам и всем тем, кто хочет научиться с 0 программировать!', 'Автор звучит как человек, который знает предмет о котором пишет. Стиль написания выбран как бы не серьёзный, с шутками-прибаутками. Думаю что это неплохая книга для начально-ознакомительного введения в программирование и первичного знакомства с языком программирования Паскаль.']",0+,2013.0
Основы нейросетей,['Константин Константинович Берлинский'],https://www.litres.ru/audiobook/konstantin-konstantinovich-berlinskiy/osnovy-neyrosetey-68485798/,3.7,3,0,,299.0,[],12+,2020.0
Изучаем Python. 3-е издание,['Марк Лутц'],https://www.litres.ru/book/mark-lutc/izuchaem-python-3-e-izdanie-24500438/,3.7,92,12,830.0,190.0,"['Очевидно, что данная книга написана либо уже для тех, кто программировал на других языках, либо знаком с Python более ранних версий. По ней вполне можно выучить данный язык программирования, но, поверьте, если вы абсолютный новичок в данной сфере, то большинство моментов вы будете понимать с огромным трудом, ибо автор касается абсолютно всех аспектов и фишек Python, что новичку совершенно не нужно.', '3-е издание неактуально. На данный момент существует как минимум 5-е, поэтому нет смысла ее брать. Сама же книга без учета издания в какой-то степени является библией Python и актуальное издание однозначно стоит прочитать рано или поздно, если вы хотите стать профессионалом в области разработки ПО на языке Python.', 'Книга вроде бы и Неплоха… Но Это Вроде бы… На Данный момент Книга Устарела – Синтаксис Языка поменялся и Приходится корректировать Постоянно… В Итоге вместо Обучения – Одни Мучения по Исправлению устарелого Синтаксиса (((', 'Книга очень хороша! Очень понятно написано и наверное каждому кто хоть раз встречался с Python будет понятно, и тем кто не встречался с этим языком.', 'Книга мне очень понравилась. Покупал для себя, примерно 2 года назад, и не капли не пожилел.Все очень кратко понятно, поймет даже новичек. Просто 10/10']",0+,
Java в примерах. Справочник. 2-е издание,['Дэвид Флэнаган'],https://www.litres.ru/book/devid-flenagan/java-v-primerah-spravochnik-2-e-izdanie-24499870/,4.4,9,0,638.0,290.0,[],0+,
Delphi. Профессиональное программирование,['Дмитрий Осипов'],https://www.litres.ru/book/dmitriy-osipov/delphi-professionalnoe-programmirovanie-24500182/,3.6,5,0,1055.0,290.0,[],0+,2006.0
Java и XML. 2-е издание,['Бретт Мак-Лахлин'],https://www.litres.ru/book/brett-mclaughlin/java-i-xml-2-e-izdanie-24500198/,4.3,7,1,547.0,290.0,"['И опять пригодилась книга написанная так давно (по айти меркам), а пригодилась, потому что все уже основное по работе с xml заложено тогда, да и книг из современных по нему, чтоб толковых и подробных с описанием применения маловато конечно, так что имейте в виду.']",0+,
Программирование на языке ассемблера,['Д. В. Лисицин'],https://www.litres.ru/book/daniil-lisicin/programmirovanie-na-yazyke-assemblera-48433271/,5.0,4,0,100.0,144.0,[],0+,2018.0
Введение в информационные технологии и программирование на языке C в среде VS C++,"['Ю. Е. Алексеев', 'А. В. Куров']",https://www.litres.ru/book/andrey-kurov/vvedenie-v-informacionnye-tehnologii-i-programmirovanie-na-ya-70399681/,0.0,0,0,101.0,288.0,[],0+,2018.0
Знакомство с разработкой мобильных приложений на платформе «1С:Предприятие 8». Издание 3 (+ 2epub),['Е. Ю. Хрусталева'],https://www.litres.ru/book/e-u-hrustaleva/znakomstvo-s-razrabotkoy-mobilnyh-prilozheniy-na-platforme-40928675/,4.3,9,3,274.0,350.0,"['Все мы знаем, как в современном мире важны мобильные технологии. Данная книга на одном конкретном примере рассматривает весь спектр наиболее интересных возможностей платформы 1С на мобильном устройстве.', 'Книга подойдет ка опытному программисту 1с,так и начинающим.Большое количество иллюстраций делает работу с книгой доступной и приятной. Рекомендую.', 'Настольная книга для только что пришедших в мир 1С программирования. Написана просто, без лишней академичности. Обилие примеров и иллюстраций делают ее понятной даже ребенку.']",12+,2022.0
